Username,Comment,Timestamp
@lazarostan,"Hi Demi.  
When i smell for the first time a Tom ford fragrance i can say i fell in love. I understood it was something different. So i start with tom ford - tom ford, noir extreme, oud wood, grey vetiver, tuscan leather, fcking fabulous, beau de jour from the private collection which discontinued, but you can find it in better price. My last buying was Soleil Neige from private collection. Check it out. In Europe the private collection is made in USA and the other is made in Switzerland. 
                             Greedings from Greece",2024-06-20 10:51:29
@jci3284,If you are in your 20s do not buy tomford frags it is BOOMER CENTRAL!!,2024-06-20 10:51:38
@jONAThAnBunt1990,If I don't like vanilla smelling fragrances -- should I not buy Tom Ford you think?,2024-06-20 10:51:31
@amandygunns,"I absolutely love the scent of Beau de Jour, I just picked up a small bottle for myself cause I love lavender. But. But. The sillage and lasting power are SO strong & long as to be....kind of intolerable to me. Lol I’m sure that will be good news to people who care about “performance.”",2024-06-20 10:51:29
@markgonzalez6016,Smells like sex? Interesting,2024-06-20 10:51:37
@chriztianjamez,"“You’re on a yacht, on a boat. Noroli Portofino, chchchcchch.” This is why I watch Demi. LOL",2024-06-20 10:51:31
@jake8001,"I watched that episode of Dacre, TF Black Orchid is his signature scent",2024-06-20 10:51:27
@carsandwhisky2002,I spent the time smelling most of the Tom Ford line. Definitely Oud Wood for me.,2024-06-20 10:51:27
@MusicIsOurSavior,I missed you darling <3,2024-06-20 10:51:34
@dexxxhunt,"Mad love Dem,nice video as always  Blessings",2024-06-20 10:51:25
@rafaeltorrezin1855,Love your lists! ️,2024-06-20 10:51:25
@nickvarga463,Ombre Leather 2018 EDP is amazing. Dries down to smooth n soft,2024-06-20 10:51:28
@arsenallakers4158,"Been looking for new perfumes i dont mind the price
It would be great if someone would give me some suggestions 
I use DG light blue,Armani gio,eros versace and Fahrenheit Dior but i really want to change the whole set
I want to buy noir extreme and tobacco vanille but some more suggestions would be welcomed thank",2024-06-20 10:51:30
@sur5notes,"My Best Five  and probably my all time Tom Ford favourite: 

Noir Extreme, F**** Fabulous, Tuscan Leather, Grey Vetiver and Beau de Jour.",2024-06-20 10:51:28
@manosfragos5988,I thought you said noir de noir was better on females,2024-06-20 10:51:32
@jimiola2781,Great video Demi. What are your thoughts on ombré leather? ,2024-06-20 10:51:27
@eyobongnyong3285,"Hi Demi, great video... Do you know anywhere the Tom Ford For Men Extreme can be bought?",2024-06-20 10:51:27
@hamadalrowaie6882,Five stars !!  what do you think of tobaco oud ?,2024-06-20 10:51:28
@jessib4137,I ️ TF!! Can you make a video of top TF for women?,2024-06-20 10:51:29
@thebsr9673,You broke my with Ombre Leather!,2024-06-20 10:51:29
@Rcova84,Black orchid edt I feel like it’s more Manly,2024-06-20 10:51:31
@markbrailsford2849,"I love Black Orchid Demi, women follow me round the supermarket when I wear this! X
Stay safe.",2024-06-20 10:51:29
@pinkpistol2789,"The best and cheap fragnance that smells luxury is no 1 only encre nior and no 2 is versace eros... ... Tom Ford, Creed, de marly all waste of money.",2024-06-20 10:51:37
@noseknowsnonotes6833,"Black Orchid & Noir de Noir are the top 2 for me, so glad that you had those",2024-06-20 10:51:21
@izzyhuppert6562,"I love both Oud Wood and Tuscan Leather. If you can only pick one, which one would you choose?",2024-06-20 10:51:27
@RizztrainingOrder,Don't wear leather!? Smh,2024-06-20 10:51:37
@redking1831,"I have tom ford neroli- I think its amazing for casual daytime summer--- It really doesnt last long and I completey 100% agree with what she said about it.  Also, the fact it doesnt last long is a positive to me, as this frag is ONLY amazing in the daytime. This means you can switch it up for night :)",2024-06-20 10:51:21
@MichaelLopresto,"Thanks for the great video, Demi. Could you please do a video and comment on Tom Ford Tobacco Oud, as a lot of people love it, but it is somewhat polarising. Would be great to have a female perspective!",2024-06-20 10:51:25
@sinzinkayodjamila7382,,2024-06-20 10:51:36
@vision7771000,"Looks like you're getting a tan girl, hot!!!",2024-06-20 10:51:36
@hamodhossain4261,black orchid is a Michael Jackson's main parfum as i remembered .. any way .. i will never choose any parfum that contains oud again .. simply because oud note always like (( ALWAYS )) dominate all the other notes smell in the perfume ( even if its a small amount of oud ) .. i just smell the oud covering up all the other notes .. so almost every perfume i have with oud gets the other ingredients washed out like it doesn't exist .. as if its pure oud fregrance .. and it makes me smell like some dude from a tent in the desert .. i hate it,2024-06-20 10:51:32
@contedivalpelline,"Great review, Demi. Agree with everything you said. Still waiting for you to review ""Eight & Bob""...",2024-06-20 10:51:22
@louiscaeiroramos8051,If you love Neroli  than you should you should try Mediterrenean Neroli Ermenegildo Zegna. Best Neroli scent and longlasting as well as huge sillage.,2024-06-20 10:51:29
@GregorySonofGod777,"I have oud wood body spray, really nice for the price!",2024-06-20 10:51:29
@amooriamoori8876,Where is Fucking Fabulous version ??,2024-06-20 10:51:36
@MarioSilva-zv9yv,If the most refined woman turned into a woman it would look just like this lady.,2024-06-20 10:51:37
@TonySoprano08,"Tobacco Oud
Black Orchid 
Tobacco Vanille 
Fougere 
Oud Wood
Noir De Noir
Soleil Blanc 
Bitter Peach 

I love those",2024-06-20 10:51:28
@benda-annevanniekerk6833,Demi PLEASE do a Tom Ford video for women ️,2024-06-20 10:51:30
@mhdrifmhmd3375,"What about Tabacco oud..?
I love it",2024-06-20 10:51:29
@Naj21-,"TOM FORD FOR MEN EXTREME is in my top 3 all time. Finally someone to mention this gorgeous frag.
Cheers",2024-06-20 10:51:23
@AbdouEN92,I’m wearing TF noir extreme as a scent of the evening just lovely fragrance ,2024-06-20 10:51:28
@looneydesi,Love black orchid and noir extreme. ,2024-06-20 10:51:29
@royaltystiming9902,I love oud wood.. but it does not last long at all I have to spray a lot on myself lol,2024-06-20 10:51:29
@ghostylo888,Ly,2024-06-20 10:51:37
@VinceB666,Hi! Whats your opinion on the standard Tom Ford for men?,2024-06-20 10:51:28
@elijahray9792,Does TV smell like PDM Herod?   I own TV an didn’t want to be redundant with Herod,2024-06-20 10:51:29
@AwsomeSauce,"Black orchid is a good scent, it's not unisex, and it is marketed toward women specifically, but we men do where it because it's very masculine for a women's fragrance, he should have marketed it as unisex .",2024-06-20 10:51:32
@Bruno-dc5iv,"i love you, your voice is so relaxing",2024-06-20 10:51:28
@brentonhenry3489,How can you hate ombre leather?,2024-06-20 10:51:31
@kristenpotter7100,"I’m obsessed with the TF Private Blends. I love how unisex they are. I wear Tobacco Vanille, Oud Wood, Soleil Blanc, Noir de Noir, Mandarino di Amalfi, and Neroli Portofino (wore this on my honeymoon in St Lucia!). I love Lavender Extreme but I can’t bring myself to buy it. Please do a list for the ladies!!",2024-06-20 10:51:25
@uncleiroh7,Fvcking Fabulous is ma Fav,2024-06-20 10:51:32
@stonecharles7163,What's wrong with wearing a leather fragrance on a date?,2024-06-20 10:51:34
@jz9172,"You got me kinda triggered when you said you hate Ombré Leather.
Spicy Cardamom, Clean leather, >>BALANCED OUT<< with Jasmine Sambac.
Kidding, still love you, keep up the great work.",2024-06-20 10:51:29
@yand5400,2020 clubbing perfume new change perfume recommend . ^^^^^^^^^;,2024-06-20 10:51:36
@robertlouisebaker-hyde1267,Fix the volume of your vids.,2024-06-20 10:51:37
@dayella3113,7:58 that example I laughed so hard AHAHAHHAAHAHAHAHAHA,2024-06-20 10:51:31
@jaycagle8416,Can’t believe you almost for Tobacco Vanille! That was first love of TF and it is one of my favorite houses.  Longevity is an issue with some but beautiful DNA. Beau de Jour was a great rerelease and I’m Very happy to see Lavender Extreme make the list. It’s also one of my favs and doesn’t get much love. Solid list but I would have to add Plum Japonais and maybe Rose Prick to my list. Enjoyed!!,2024-06-20 10:51:22
@noneofbusiness7739,What lipstick color/brand is that?,2024-06-20 10:51:30
@999vincy,"Black Orchid, very polarizing. Mood changing scent.",2024-06-20 10:51:29
@ptock1975,"Hi Demi. Great video as always. I know it's a bit late, but I want to get a clean TF and was thinking about Beau de Jour or Coasta Azzurri. BdJ sounds better, kinda like Platinum Egoiste. Which should I get? Thanks for Ireland",2024-06-20 10:51:28
@PurAquas,Noir extreme is the best hands down,2024-06-20 10:51:30
@joshuadoty4251,My top Tom Fords 1. Plum Japonais 2. Noir de noir 3. Tobacco oud 4. Noir pour femme (I prefer this over extreme️ similar but projects better) 5. Black orchid EDP or EDT ️ 6. Tobacco Vanille 7. Lost cherry .. only because it smells good on its own and layers beeeeeautiful with plum Japonais and tobacco vanille,2024-06-20 10:51:22
@MFloresReviews,Tom Ford guy here. Glad some of mine made this list.,2024-06-20 10:51:29
@FouriousBear,"Hello Demi. Please can you help me.. I looking for a Tom Ford smell citrus,fresh sexy smell for summer.. Something like Armani  Aqua Di Gio but from Tom Ford.. Is Neroli Portofino good choice? Or maybe you can reccomend other one.  BtW you look like me friend, and sorry for my English.. Greetings from Poland. ;)",2024-06-20 10:51:30
@steliosc.4686,Actually my most complimented by women are Grey Vetiver edp and Oud Wood. I personally can't stand smelling Black Orchid yet alone wearing it. Very nauseating to me. But i do agree on Tom Ford Extreme. Beautiful scent and underappreciated. Nice video.,2024-06-20 10:51:22
@dannyo5364,Michael Jackson wore black orchid,2024-06-20 10:51:36
@danieish5982,"I need your review about smart collection perfumes...
Especially Creed,Dior sauvage black orchid versions of smart collection",2024-06-20 10:51:30
@maxblack404,"i enjoy watching your videos! btw demi and others, i’m planning on blind buying gucci flora edp, lancome tresor midnight rose and ysl mon paris but i only want to buy 2. which one do you guys recommend? pls help a sister out. thanks x",2024-06-20 10:51:27
@MrMelonMan96,Trey Songz wears Black Orchid + Orchid Soleil blend,2024-06-20 10:51:30
@TheFragnatic,"my top 5

Fucking Fabulous
Lost Cherry
Tobacco Vanille
Plum Japanois
Ombre Leather",2024-06-20 10:51:36
@DragonCarlin1982,Tuscan Leather.... class and presence,2024-06-20 10:51:31
@loickoffi7091,Good top 10 but where is tobacco Oud ?,2024-06-20 10:51:30
@phillipsamuels6719,Tom ford is awesome black orchid wonderful,2024-06-20 10:51:31
@ThatBoiDvnny,Link to the for men extreme?,2024-06-20 10:51:30
@invictafilms2690,"I got a 50ml decant of Tuscan Leather, really looking forward to trying it, but I really want some Neroli Portofino and Tobacco Vanille to add to my collection, but don’t want to go broke.",2024-06-20 10:51:25
@johnbwilson1,"Excellent. What do you think about TF Mandarino Di Amauri Acquaint for a man?  Got some as a gift, not sure I like it though.",2024-06-20 10:51:28
@ec2487,Where can I buy the Tom Ford extreme? It's sold out everywhere,2024-06-20 10:51:28
@danielkocur7241,My faviiort tom ford didn't make it lost cherry try it if you have not,2024-06-20 10:51:32
@silverstone3228,How about oud 24 hours ? Is it close enough to black orchid?,2024-06-20 10:51:29
@AlexGrocio,3:57  OMG!,2024-06-20 10:51:32
@carlitobrigante7625,Tom Ford Noir Extreme & Beau‘de Jour are My favorites ,2024-06-20 10:51:28
@punitpatel5565,This girl is kind of black orchid,2024-06-20 10:51:37
@KDAirman,I have black orchid EDT and doir intense in my collection currently,2024-06-20 10:51:30
@timwessels2886,Very nice Demy!,2024-06-20 10:51:29
