Username,Comment,Timestamp
@Dabayare,"I don't smoke or drink, a sporty nerd who like baking. So Black Orchid is my favourite and got everything I am familiar with from the vanilla, flowers etc.",2024-06-20 10:51:27
@kutmastaben,Plum Japonais!,2024-06-20 10:51:35
@roadtoentzugsklinik8039,You need to check Tom Fords Venetian Bergamotte !!!! Summer Killa,2024-06-20 10:51:31
@SgtG3,TF EXTREME IS AWESOME VERY UNDERATED ,2024-06-20 10:51:32
@darko140,Thx i wait for the List cheers from Vienna ,2024-06-20 10:51:28
@TheFragranceWardrobe,Well I guess I’m going to wear Noir Extreme a lot more now,2024-06-20 10:51:30
@ayazmalik5260,Noir Extreme. What a fragrance...wow. Just. It’s Demi in a bottle. Demi is a ‘kulfi-Girl’ ,2024-06-20 10:51:29
@Rozzjd,8:35 You don't smell this fragrance on a man because... it's discontinued ,2024-06-20 10:51:36
@Reclaim68,I know you can't include them all and it's subjective but Plum Japonais is lovely too!,2024-06-20 10:51:29
@ashrafkob,"My top three are : oud wood, noire extreme and Tuscan leather. Greetings from Palestine",2024-06-20 10:51:30
@liviosiebenhaar3801,Where is TF Fucking Fabulous?,2024-06-20 10:51:36
@lugscogs5976,I beg to differ because Ombre leather is one of their best.,2024-06-20 10:51:31
@TheDon.777,From itz Demi recommended am game. ,2024-06-20 10:51:31
@bradleystroup1457,"I have 2 bottles of for Men Extreme. Love that scent, it smells sooo amazing, you want to keep smelling it",2024-06-20 10:51:29
@qamarzaman3708,"Are you also use these kind fragrance,  women",2024-06-20 10:51:32
@sandeepchawla8832,It has Indian Kulfi accords(Indian dessert)that makes it sweet like I m gonna eat u ,2024-06-20 10:51:34
@jigilous,I wore Black Orchid and it made me smell like someone's Aunt.,2024-06-20 10:51:36
@justinscents81,I have Tom Ford Extreme Noir ,2024-06-20 10:51:31
@sibyl999,What should women wear from TF?  I don’t have any as yet..  Also are you aware of the Neroli Portofino Intense or whatever it’s called?  I heard longevity issues were assessed..,2024-06-20 10:51:29
@AlexGrocio,9:32 OMG!,2024-06-20 10:51:32
@doublemaster2020,beautiful ️,2024-06-20 10:51:31
@smokinscars1024,Tabaco oud is out of the game I guess,2024-06-20 10:51:31
@Alex-pd4ug,"Any Idea is Oud Wood would be fine on a younger guy, like 20-24?",2024-06-20 10:51:31
@sanjaofficial255,Black Orchid was the Fav Parfum of Michael Jackson too! He used it as room spray,2024-06-20 10:51:29
@habibtelolita9534,Im a woman and I wear black orchid I love it and it’s unisex,2024-06-20 10:51:31
@Plattenbruther,What do you guys think of La Yuqawam pour Homme? Does anybody happen to have tuscan leather and can give a comparison? Regards,2024-06-20 10:51:29
@CaliReviews,"wow no oud tobacco , im a bit surprised",2024-06-20 10:51:31
@Quan1993,Wow you’re beautiful ,2024-06-20 10:51:37
@alxs3475,Black orchid is sooo for women!,2024-06-20 10:51:32
@adamdar5121,Tobacco vanilla is a horrible fragrance,2024-06-20 10:51:38
@molonlavecy,"Demi....what about Ombre Leather????  How come not in the list?
:)",2024-06-20 10:51:31
@felixquinones8052,Damn she makes me want to buy all of them,2024-06-20 10:51:32
@micpay,Wondering about what makes a perfumer critic??? You go to college or idk just curious ??? Like I said idk but seems everybody has there own preferences????,2024-06-20 10:51:30
@JIM6001,Please check out <<Fucking fabulous>> from Tom Ford House.,2024-06-20 10:51:34
@30minutesLess,Noir extreme is my shit! I absolutely know when it is hypnotizing someone,2024-06-20 10:51:30
@ajsilva78,"Im using right now Black Orchid, is amazing...you feel a diferent kind of person with that",2024-06-20 10:51:22
@JuanCarlos-wx2tg,plum japonais is one of my favorites,2024-06-20 10:51:30
@mahdimahdishams7735,I have Tom Ford black orchid,2024-06-20 10:51:31
@Zeppelinpuppy,Girl please pay your electric bill I can barely see you. Thanks 4 the review though,2024-06-20 10:51:37
@antoniosmith197,The original Tom Ford for men smells horrible and this is coming from a guy,2024-06-20 10:51:38
@AnakinSkywalker-mm3gi,My favorite Tom Ford from the Signature line is Grey Vetiver and Tobacco Vanille from the Private Blend line. GV is great for work and TV for cold fall and winter nights.,2024-06-20 10:51:21
@minibus1351,Tuscan Leather is my number 1.,2024-06-20 10:51:30
@mikecapalungan,"I don’t like many sweet scents, but D&G The One, Versace Eros, Replica’s Jazz Club, and TF Noir extreme have been my favorite sweet scents",2024-06-20 10:51:23
@ajsilva78,"Tom 'love or hate"" Ford",2024-06-20 10:51:32
@jamescashion8608,"Costa Azzura's my go to, but I've gotten tons of compliments from women wearing Grey Vetiver",2024-06-20 10:51:31
@JohannesRunquist,Dazzling as ever… I really love Tom Ford Oud Wood. What's your take on Floris Honey Oud?,2024-06-20 10:51:22
@uropy,"Among all TF fragrance for men, which one do you recommend for a date on a summer night? I wear Tobacco Vanille for winter but feel it’s prob not best for wear in summer.",2024-06-20 10:51:28
@MrHarlekin7,Noir de Noir best Parfum on the earth,2024-06-20 10:51:32
@joeblack2214,Eh? What? Whats that you say? Speak up dear.,2024-06-20 10:51:38
@emancebo13,You have a clearly have a thing for suits...,2024-06-20 10:51:36
@Kaya6067g,Can you please do top 10 Tom Ford fragrances for women?,2024-06-20 10:51:29
@xebena,Can you please also include links and recommendations of where to purchase fragrances for Australian customers?,2024-06-20 10:51:28
@juxtluv5382,First ,2024-06-20 10:51:37
@dusthart8303,I got hooked on jazz club after your review bought two bottles I love it and grabbed a bottle of fireplace. What would be something as good or better then jazz club or is that even possible. Any house idc jazz club was best suggestion ever,2024-06-20 10:51:30
@diathekedriven,I got Grey Vetiver EDP and it's possibly one of the worst fragrances I own. It nearly makes me sick. Can't wait to get rid of that garbage.,2024-06-20 10:51:34
@mambamentality2663,"Tuscan leather best, end of story",2024-06-20 10:51:36
@ardenpowers7730,"Fantastic picks Demi !
Black Orchid really makes a statement for/on me.
Noir Extreme is so very, very nice for a night out or for intimate moments . . . 
Thanks as always for sharing . . .",2024-06-20 10:51:23
@BeachPleased,"Please do 
Top 5 Fragrances from Chanel for Men/ Women
Both from Main Line and Exclusive line",2024-06-20 10:51:29
@joshuabaca6257,"So, I need a suit.",2024-06-20 10:51:31
@rasbmenelik2,I have the grey vetiver edp but through no fault of my own...I get no direct compliments. I can smell it on me but no one else can..help please.,2024-06-20 10:51:30
@whynot7802,Neroli portifino hands down my fave.but expensive af,2024-06-20 10:51:31
@davidfreeburn8592,Paco rabbane  original green bottle,2024-06-20 10:51:34
@matthewsilton502,This is my favorite house!,2024-06-20 10:51:30
@lizasoberano6612,So what is for you black orchid or the noir extreme?,2024-06-20 10:51:29
@timschulz3714,"I've been looking for a new fragrance that smells like Prada l'homme (my favorite), now I'll have to give Tom Ford Neroli Portofino a try!",2024-06-20 10:51:28
@chrismccall797,I’m in love with Tom Ford Lost Cherry ,2024-06-20 10:51:28
@tariklewis2432,"Neroli portafino, soleil neige, lost cherry, tobacco Vanille, oud wood, nor extreme, velvet orchid...all my faves",2024-06-20 10:51:28
@jessemays7283,Tobacco vanille is amazing and i like lost cherry. I tested the neroli portofino and I wanted to be sick.,2024-06-20 10:51:30
@abdelkarimglt5578,"Demi for me the BEST TF fragrance is TOBACCO OUD️.
It describe: POWER, RICH, EXPENSIVE, STRONG CARACTERE, A PERSONALITY, A WEAPON",2024-06-20 10:51:30
@janiceburgess4679,I love Tom Ford fragrances... I own at least 10. Lol,2024-06-20 10:51:36
@StoicOutlaw17,Oud Wood is my favorite.,2024-06-20 10:51:30
@joesmellsgood,Why do women hate leather. I don't get it,2024-06-20 10:51:37
@throwthejavelin368,Can you make reviews on he house of Louis Vuitton?,2024-06-20 10:51:30
@uneditedreviewsbyjess6502,"TF Black Orchid is my signature fragrance for fall and winter... I CAN'T SEE ON A GUY, NOPE. It's too feminine... would be a turnoff",2024-06-20 10:51:36
@Ady-gt8xh,@demirawling which is better tom ford noir or noir extreme,2024-06-20 10:51:29
@mohamadfallah3700,"Please review
Santal musk",2024-06-20 10:51:31
@markchen5710,neroli portofino smells like bathroom cleaner to me. I hate it .,2024-06-20 10:51:36
@angelinajackson7046,What about Tom Ford white suede?,2024-06-20 10:51:30
@robertjr1254,Fucking fabulous didn't make the list.  Way better than feminine black orchid. Black orchid is listed as women's in his website.,2024-06-20 10:51:36
@kevkev3340,Tobacco vanille or Oud Wood? a hard one haha,2024-06-20 10:51:30
@worththewatch1517,The Aussie accent is too obvious ,2024-06-20 10:51:37
@andrewkroussoratsky7737,Thanks Demi! Agreed; the For Men doesn't get enough love. Why smell boyish when can smash out something masculine?,2024-06-20 10:51:28
@Heartbeatt101,Please do the same for women ️,2024-06-20 10:51:31
@milanheusschen,"Thinking about to get Tom Ford Noir Extreme for a long time, now I finally decided to purchase this beauty.",2024-06-20 10:51:21
@ShaiirahCattzYouh,"I feel like this one doesn’t get mentioned enough but I LOOOVE TF’s Vanille Fatale. For me it’s a perfect smokey, gourmand-y vanilla   the perfume is absolutely intoxicating and addictive ",2024-06-20 10:51:25
@MrBrownstone1,"Love a Tom Ford video, cheers Demi. FWIW my top TFs  - 
1. Ombre Leather
2. Plum Japonais
3. Tuscan Leather
4. Noir Extreme
5. Noir de Noir
6. Tobacco Vanille
7. Lost Cherry
8. Oud Wood",2024-06-20 10:51:28
@sebastianstalfors1787,"I swiched from the Neroli Portofino to the Mandarino Di Amalfi. I don't agree that the Mandarino Di Amalfi is for women, it's probably unisex, but most for men. But I do agree that Portofino is great.",2024-06-20 10:51:29
@julianheusschen,"Last week I bought Invictus for a friend of mine his birthday, I received a sample of Tom Ford's Beau de Jour. Immediately loved this scent when I smelled the sample. Yesterday I decided to order a 100ml of this fragrance.  Can't wait to wear it!",2024-06-20 10:51:19
@markgonzalez6016,Tom Ford Noir Anthracite anyone?,2024-06-20 10:51:32
@thattallassnikka,Top 10 Dior and Chanel,2024-06-20 10:51:31
@kaitrosem6352,From watching the video it seems like every one of these colognes is appropriate only if you have a suit on...,2024-06-20 10:51:31
@anonymousaviator277,Demi you are a gorgeous woman. Im literally stunned by you... ,2024-06-20 10:51:32
@musar.2014,Can you make a video of affordable niche fragrances,2024-06-20 10:51:30
@timmspencer4632,Tom Ford extreme is absolutely incredible. Really hard to find though. Bought a bottle last year last one in the store,2024-06-20 10:51:22
@GregorySonofGod777,"Black orchid suits me and has the best performance. 9.5/10 easily. Oud wood is nice, however the performance is not great and for the price, it's a bummer.",2024-06-20 10:51:30
@SUPERlol22a,what about mr. fabulous?,2024-06-20 10:51:31
@droyal1994,You said the noir extreme makes you want to eat me and I bought it instantly lmao good sales skills,2024-06-20 10:51:30
@kpower4362,"61/M Just picked this up after reading other reviews and trying it. Amazing from top to dry down. Lasts forever! Go light on the application as it has a strong presence. Thanks Demi, and keep up the great reviews.",2024-06-20 10:51:21
@IndoScents,Tom ford for the real gentlemen ️,2024-06-20 10:51:30
@budapest5579,"Tom Ford if I had to chose only three for life 
1 TF Fabulous 
2 TF Tobacco Vanille 
3 Black orchid",2024-06-20 10:51:31
@tatianacatherine5070,Neroli Portofino is on my wish list. I wish TF hadn't discontinued the Ombre Leather 16 scent (much better than the Ombre Leather or Tuscan Leather).,2024-06-20 10:51:31
@rutube007,"I'm yet to try Tom Ford. Have been wondering where to start. So thanks so much for this video, but I'll appreciate if you can stop spying on me Demi Rawling.",2024-06-20 10:51:32
@media4u617,I just subscribed  you explain the fragrance perfect,2024-06-20 10:51:28
@jarulejunior3222,Looks like she falls asleep,2024-06-20 10:51:37
@ausaamahqureshi2061,"I like ombré leather and fucking fabulous on me a lot, just something about the leatheriness mixed with a smoothness does it for me",2024-06-20 10:51:28
@gianniferrari1122,Best house in the game! Every scent mostly has creative DNA.,2024-06-20 10:51:31
@OscarLopez-cu7xg,beau de jour tom ford is a similar to zino davidoff?,2024-06-20 10:51:30
@preiss0,"1. Oud Wood.
2. Oud Minerale.
3. Neroli Portofino Forte.",2024-06-20 10:51:31
@mr.smellgood2794,That Tom Ford Noir Extreme is my favorite smells really good. It works so well for me and its  super beast mode  off my skin..,2024-06-20 10:51:21
@lazaro2710,"Demi what are your thoughts on Beau De Jour and Neroli Portofino longevity and sillage. Friends who also wear Jacket and Buttom Down Shirt complain on their longevity in our Warm Weather.  I have purchased long time a go Black Orchid and it was a beast mode fragance, so really want to find out if these two come with that long time performance which is important for me. Regards from Costa Rica",2024-06-20 10:51:28
@SteffenDolleris,"YES! Been waiting for this for so long 
Greetings from Denmark 🇩🇰",2024-06-20 10:51:22
@matchymatchy5978,Black orchid outdated and went common as well as copied thousands times.....,2024-06-20 10:51:37
@hepdragon32,"So an ex-girlfriend of mine, whenever she left for work, would ask me to spray Tom Ford Noir Extreme on her tummy so she could have my ""scent"" hanging around her all day.",2024-06-20 10:51:36
@aburafey6974,"Hey Demi, nice list but I was expecting Tobacco Oud as well in this list, stay safe tc",2024-06-20 10:51:30
@joe12524,"Could any help me out please? I'm going to purchase Diors eau sauvage eau de parfam sometime soon, and I'm considering a night/colder weather fragrances to compliment the eau sauvage any suggestions.",2024-06-20 10:51:29
@ediabdijeski9417,The next perfume I will buy is Tuscan Leather,2024-06-20 10:51:31
@brianc8157,Out of the shower and strange anywhere else? For the days I'm chilling in the bathroom? :D,2024-06-20 10:51:32
@brendaslummer8890,Do you prefer Tabacco Vanille or Marly Herod?,2024-06-20 10:51:29
@user-zk8qr6ym8o,"Hello, I like classic perfume style. Does it fit me well? Could u briefly expain the scent again???",2024-06-20 10:51:28
@SgtG3,Great review and recommendations. BTW you look amazing. Awesome line up,2024-06-20 10:51:23
@MrTheomighty1,"I own black orchid and today I’ve received my bottle of Tom Ford Beau De Jour I purchased this as I’m going out to a meal with all my work colleagues and I wanted to stand out, I’m just undecided on what to wear, Demi or anybody I’ve got burgundy chinos and pink chinos with a royal blue sports jacket not sure what colour shirt to wear ",2024-06-20 10:51:28
@dearmama9728,That's nice because I hate to hear fragrances adores from mens when a beautiful woman tells you its good then you know,2024-06-20 10:51:34
@leirbagrednas,“If in a suit”,2024-06-20 10:51:37
@danlutter8061,"Neroli Portofino lasts about as long as 4711.  The scent is great, but the price is outrageous for what it is IMO.",2024-06-20 10:51:29
@Batman2006100,"Thank you Demi. I have: black, grey y ombre leather. I love them. You are so beauty.",2024-06-20 10:51:25
@EmmaSmith-dh6dq,"Please do: 
Top 5 fragrances from Dior for women/men 
Top 5 fragrances from Chanel for women/men 
Top 5 fragrances from Guerlain for women/men 
Both from the main line and exclusive line.",2024-06-20 10:51:29
@lennonseow90,"No Ombre Leather?
Ombre Leather is more wearable and versatile than Tuscan Leather yet at the same time, the price is way cheaper than the latter.",2024-06-20 10:51:31
@Liverpoolaussie21,no Fabulous?,2024-06-20 10:51:31
@marianneibrahim6420,My dad smell black orchid on me and he took it away  Now i need to buy another bottle...,2024-06-20 10:51:34
@superfatbass,"Hi Demi, just realised I've been watching you for ages, but hadn't subscribed, not anymore,  Keep up the good work,..have you checked out Killa Frags from the UK,funny guy, ok good luck Demi,",2024-06-20 10:51:31
@sophie_omongain,You should do a top 10 Tom Ford perfumes for women,2024-06-20 10:51:28
@georgegenovese243,Also the tom ford noir really worths,2024-06-20 10:51:31
@julesp1669,"All I hear is how good, how oriental, how amazing, etc...what are the top, heart and base notes? Hello.",2024-06-20 10:51:31
@papatzis4032,"3:56 
That’s it I’m buying Noir Extreme",2024-06-20 10:51:32
@Gabos_Parfums,Unfortunately oud wood does not perform its only good for like 3 hours I regret buying it only wish I had the old school bottle that juice last a long time,2024-06-20 10:51:31
@alexanderslowinski2054,Costa Azzurra!,2024-06-20 10:51:34
@BestBrandsPerfume,"Who else thinks Tom Ford Makes Some ""BADA$$"" Fragrances?",2024-06-20 10:51:22
@gianniferrari1122,"My Top TF - 

1. Tuscan Leather 
2. Champaca Absolute (Nobody wears this... Don't know why!!!?) 
3. Soleil Blanc EDP 
4. Grey Vetiver",2024-06-20 10:51:30
@shakomarzashvili6490,My choice is the Cafe Rose ,2024-06-20 10:51:30
@michaelmoreno9522,"Why did she whisper the word ""sex"" but say ""Fucking Fabulous"" loudly ",2024-06-20 10:51:36
@DevilsDiscretionAdvised,"She probably wouldn’t be so shiny and fake if she didn’t over tan , wear way way too much lipstick and she actually wore makeup",2024-06-20 10:51:37
@luckyraspberry3712,"1. Oud Fleur (this makes me m e l t)
2. Venetian Bergamot
3. Patchouli Absolu (you either love or loathe this)
4. Oud Wood 
5. Sole Di Positano",2024-06-20 10:51:29
@bdavis0625,I’ve been looking forward to this one Demi! Thanks!!,2024-06-20 10:51:23
@elie6769,She loves tom ford noir extreme Shi mni7 one of her favs. One of her favs. Hates ombre leather btefham,2024-06-20 10:51:30
@Shaari,"Noir Extreme is easily my favourite. One of my go to date scents along with Herod, By the Fireplace, The One, La Nuit de L'Homme. For daily and formal situations, Grey Vetiver is perfect.",2024-06-20 10:51:22
@Eclapce,I remember going to buy black orchid and the lady at the perfume kiosk said “eww no not that one” lmfao. It smelt like hot leather lol,2024-06-20 10:51:29
@ahmedsallam1179,I love black orchid but unfortunately my mother and sister hate it so much is stopped wearing it,2024-06-20 10:51:29
@johnny_profumo5438,Tom Ford just does bold fragrances well. Awsome video!,2024-06-20 10:51:23
@garrydhaliwal786,"As you’ve said black orchid is great, edt or edp which is more better for man ?",2024-06-20 10:51:28
@scarroll625,Ombre Leather is amazing,2024-06-20 10:51:29
@soultruesk8rlifelong,Dacre is the sole reason I want to try Black Orchid,2024-06-20 10:51:30
@TheDigitalLamb,The Tom Ford for men extreme is discontinued now and really hard to find.,2024-06-20 10:51:30
@bresden,"Good to hear TF for Men Extreme get some love. It’s one of the frags that got me into fragrances. It has zero projection, but I’ve gotten compliments from women who came in close. Still keep a backup bottle. Underrated gem.",2024-06-20 10:51:20
@LeBeautiful,Noir De Noir...so glad to see that one. Would have some of the newer Tom Ford Soleli series here too. I wish for safety for you and every subscriber on here! ,2024-06-20 10:51:21
@fireabend,I think that Michael Jackson also used to wear Black Orchid,2024-06-20 10:51:32
@mo9650,Thank you for this video. I'm a huge Tom Ford fan,2024-06-20 10:51:23
@yand5400,Tom ford woman top 10,2024-06-20 10:51:36
@yungmacks8016,So seductive ,2024-06-20 10:51:37
@JT-rx1eo,"Beau de Jour is my favorite Tom Ford. And it's my #1 favorite ""barbershop"" Fougere out of my barbershop Fougere collection. It's the beauty of those aromatic herbs - rosemary,  basil, mint - blended into the heavy lavender and lavendin that sets it apart from my Penhaligon Sartorial,  TF Fougere D'Argent,  MDCI Invasion Barbare,  YSL Rive Gauche Pour Homme,  etc.",2024-06-20 10:51:28
@SurfersSilver,"You just stating a fact

Out of 10..i already use 3 of them...Black orchid, oud wood, and Tobacco vanille...

Btw, Fucking fabulous seriously smell so good",2024-06-20 10:51:29
@lukeflynn3943,Any other kiwis here?,2024-06-20 10:51:36
@Badmintonbyshreyans,What about ombre leather,2024-06-20 10:51:31
@marianneibrahim6420,Could you please do a similar TF video for women? ️,2024-06-20 10:51:29
@goldenbey913,love it!! thank you,2024-06-20 10:51:28
@phillipsamuels6719,Love oud wood,2024-06-20 10:51:31
@barrondna2894,What you think about Gant Adventure ?,2024-06-20 10:51:30
@HoaNguyen-xd3ys,"very helpful for my new buy, thanks Demi <3",2024-06-20 10:51:23
@michalsindelka9867,I would love to see Top 5 Amouage or Roja,2024-06-20 10:51:29
@Criglet7,Tom Foir Noir EDP in the black bottle is good.,2024-06-20 10:51:29
@MrCanadiansingh,"Tomford makes unique yet mad expensive fragrances
I have tuscan leather, noir, oud wood, tobacco vanille, black orchid and fucking fabulous they are all my favorite",2024-06-20 10:51:29
@ryanstecken7457,"TF noir extreme is happily underrated and not everybody knows him, my signature smell",2024-06-20 10:51:29
@meat_loves_wasabi,Simply love TF Tobacco Oud & Tobacco Oud Intense,2024-06-20 10:51:27
@timothys9288,"I'm a man and I think Shanghai Lily is a masterpiece and the best fragrance Tom Ford made.  It might have been marketed to women, but it's got masculine notes like clove, resins, black pepper, spices, incense and vanilla which I think make it quite unisex.  Also, I love the scent of Lily and couldn't find any other fragrance which had a masculine bend so I could wear a Lily scent....except this one.  Can't believe it got discontinued although it can still be found online in some places until it runs out of stock.   What are your thoughts on a man wearing Shanghai Lily?   It really works for me personally.  And I'm definitely masculine.",2024-06-20 10:51:22
@peterstylianou3827,"Ah My dear
How could you hate Ombre Leather? It’s got me tons of Compliments , plus it’s quite similar to Tuscan?",2024-06-20 10:51:30
@MJM111977,Gotta get my nose on Lavender Extreme.,2024-06-20 10:51:30
@freepaultchoutamotaebalasi9804,"1-Noir de Noir
2-tobacco vanille
3-tobaccou oud
4- oud wood
5-Arabian wood",2024-06-20 10:51:30
@CraftyKrystal,Do the woman's version!,2024-06-20 10:51:30
@user-ep6vr1sw1m,Привет.Очень часто выпускаете ролики.Но смотреть на Вас приятно,2024-06-20 10:51:31
@lucasniehaus2189,"I literally have the same imagination as you when you talked bout Neroli Portofino, white t shirt, yacht, boat chu chu chu  these imaginative description makes the fragrance comes to live on a person! And I really like the idea! I hope you can talk about Top 10 Christian Dior fragrance on men ",2024-06-20 10:51:25
@alexanderrobertking,"So I am in no way saying that people should get creative wearing fragrances to job interviews, but Grey Vetiver works. Like, GV has to be a top 10 formal cologne of all time.",2024-06-20 10:51:30
@Rhino11111111,Tom Ford fragrances are best worn at night  time because they are a bit naughty,2024-06-20 10:51:36
@dylandriscoll7043,Do a Video in College Fragrances!!! Or Seasonal,2024-06-20 10:51:30
@wetstinkysocks,Finally! Someone who doesn’t enjoy Ombre Leather . It might just be the only TF I don’t like. I’d rather point people towards a John Varvatos or CH prive for that Ombre Leather vibe. Good list!,2024-06-20 10:51:28
@rkanmulla6496,Thx alot for the video ,2024-06-20 10:51:28
@ranieremazzilli_,Black orchid is female,2024-06-20 10:51:37
@raphael9197,I got my nose on tom ford metallique. Though it’s labeled for women it’s not too fem for man I thought it was unisex when I smelled it but got home and looked it up and says women on some sites & unisex on others. I think I’m going bk tomorrow to get it. Dillards has buy Tom ford frag and get any bottle of extra tester they have for free. It’ll be over after Saturday.,2024-06-20 10:51:31
@gallo81,"Hey Demi, I really enjoy your reviews and I was expecting a Rose Prick one, did you do one? Did you like it? Greetings from Mexico. Regards",2024-06-20 10:51:26
@blazyeye8814,Do one for roja parfum,2024-06-20 10:51:31
@jornvingerhoets2944,"Nice list thanx
I'm really gonna try the men extreme",2024-06-20 10:51:23
@johnseidl8791,"Thank you for the video. Have been looking to try some new colognes, and I'm somewhat new to Tom Ford. I will be trying the Noir Extreme, mainly from your review of it. How could I not try it lol. I have a question about one of them. I received Tom Ford for Men in a sampler I got a while back, and I really liked it. So is the Tom Ford for men Extreme just a stronger version of this or a different fragrance?",2024-06-20 10:51:24
@Tyler2004durden,"I agree 100% about Tom Ford For Men Extreme. It's my favorite from TF and also on the top of all time favorite fragrances. I'm devastated that it's discontinued, luckily I have two bottles that I'm saving until I die. Estée Lauder needs to bring this back!",2024-06-20 10:51:28
@mamohookah5944,Ombre leather and fucking fabulous are the best,2024-06-20 10:51:31
@alexluke84,"Demi, that video rocks  great list and articulate explamations why you prefer each fragrance, I've enjoyed it a lot ",2024-06-20 10:51:22
@anwarmustafa4914,U were my Netflix during the lockdown ️️️️,2024-06-20 10:51:22
@mileddaaboul4506,"Would love to see a review of amouroud fragrances from ""the perfumers workshop""..",2024-06-20 10:51:30
@wurst719,tom ford for men extreme is absolutely awesome.,2024-06-20 10:51:29
@Marocain487,Hello From Morocco Demy Love Ya🇲🇦,2024-06-20 10:51:30
@DasaScent,I have Tom Ford pour Femme and I love it ,2024-06-20 10:51:21
